{
  "contract": "review-loop-standalone-spawn-decision-v1",
  "target_ref": "repo:standalone-context-free-bootstrap-2026-04-15",
  "next_session_role": "working",
  "requested_agent_type": "verify-reviewer",
  "reason_code": "initial_working_session",
  "decision": "allow",
  "recorded_at": "2026-04-15T08:59:00Z",
  "prior_session": {
    "agent_id": null,
    "session_role": "none",
    "reuse_blocker": "not_applicable"
  },
  "evidence": {}
}
